{"schema":"forge.gate0-studio-telemetry","schema_version":1,"recorded_at_utc":"2026-09-01T13:52:46.631Z","target":"wasm_browser","webgpu":{"status":"checking","diagnostic_injection":false,"reason":"Gate 1 runtime CPU/ECS observed; GPU presentation remains not_observed"},"loading":{"wasm_started_ms":343.39999997615814,"webgpu_ready_ms":null,"scene_ready_ms":10104.299999952316},"memory":{"wasm_linear_bytes":375652352,"js_heap_used_bytes":16005372,"js_heap_limit_bytes":4395630592,"js_heap_api_available":true},"frame":{"warmup_samples":60,"samples":120,"duration_ms":1287.2000000000005,"mean_ms":10.726666666666668,"p50_ms":10.5,"p95_ms":12.3,"p99_ms":14.1,"max_ms":14.4,"mean_fps":93.22560596643876,"one_percent_low_fps":70.17543859649123,"hitches_over_16_7_ms":0,"hitches_over_33_3_ms":0,"histogram":{"frames_at_or_below_16_7_ms":120,"frames_over_16_7_ms_at_or_below_33_3_ms":0,"frames_over_33_3_ms":0}},"interaction":{"handler_to_post_paint":null,"stable_canvas_observations":0,"unstable_canvas_observations":0},"viewport":{"starts":1,"canvas_width_px":1408,"canvas_height_px":966},"permissions":{"allowed":{"command":"execute_studio_command","status":"not_run","reason":null},"denied":{"command":"plugin:window|set_title","status":"not_run","reason":null}},"limitations":["Frame time is measured from the Bevy WASM update loop, not a GPU timestamp query.","performance.memory is Chromium-specific and may be unavailable or quantized."]}
